{
  "$schema": "./schema/privileged-roles.schema.json",
  "description": "Fallback sensitive-role policy used alongside live Microsoft Graph role definitions. Runtime isPrivileged and rolePermissions data handles current built-in and custom roles; this list supplies explicit targets and a fallback when preview classification is unavailable.",
  "version": "0.6.0",
  "lastUpdated": "2026-08-17",
  "reference": "https://learn.microsoft.com/entra/identity/role-based-access-control/permissions-reference",
  "roles": [
    {
      "name": "Global Administrator",
      "templateId": "62e90394-69f5-4237-9190-012177145e10",
      "tier": "Critical",
      "reason": "Full access to all administrative features in Entra ID and services that use Entra identities"
    },
    {
      "name": "Privileged Role Administrator",
      "templateId": "e8611ab8-c189-46e8-94e1-60213ab1f814",
      "tier": "Critical",
      "reason": "Can manage role assignments for all Entra ID roles including Global Administrator"
    },
    {
      "name": "Privileged Authentication Administrator",
      "templateId": "7be44c8a-adaf-4e2a-84d6-ab2649e08a13",
      "tier": "Critical",
      "reason": "Can set or reset any authentication method for any user, including Global Administrators"
    },
    {
      "name": "Global Reader",
      "templateId": "f2ef992c-3afb-46b9-b7cf-a126ee74c451",
      "tier": "High",
      "reason": "Can read everything that a Global Administrator can, exposing sensitive configuration data"
    },
    {
      "name": "Security Administrator",
      "templateId": "194ae4cb-b126-40b2-bd5b-6091b380977d",
      "tier": "High",
      "reason": "Can manage security features, read security reports, and manage Conditional Access policies"
    },
    {
      "name": "Conditional Access Administrator",
      "templateId": "b1be1c3e-b65d-4f19-8427-f6fa0d97feb9",
      "tier": "High",
      "reason": "Can manage Conditional Access policies which control access to all resources"
    },
    {
      "name": "Exchange Administrator",
      "templateId": "29232cdf-9323-42fd-ade2-1d097af3e4de",
      "tier": "High",
      "reason": "Full access to Exchange Online including mailbox access and mail flow rules"
    },
    {
      "name": "SharePoint Administrator",
      "templateId": "f28a1f50-f6e7-4571-818b-6a12f2af6b6c",
      "tier": "High",
      "reason": "Full access to SharePoint Online including all site collections and settings"
    },
    {
      "name": "User Administrator",
      "templateId": "fe930be7-5e62-47db-91af-98c3a49a38b1",
      "tier": "High",
      "reason": "Can manage all aspects of users and groups, including resetting passwords for limited admins"
    },
    {
      "name": "Application Administrator",
      "templateId": "9b895d92-2cd3-44c7-9d02-a6ac2d5ea5c3",
      "tier": "High",
      "reason": "Can manage all aspects of app registrations and enterprise apps, including credentials"
    },
    {
      "name": "Cloud Application Administrator",
      "templateId": "158c047a-c907-4556-b7ef-446551a6b5f7",
      "tier": "High",
      "reason": "Similar to Application Administrator but cannot manage application proxy"
    },
    {
      "name": "Authentication Administrator",
      "templateId": "c4e39bd9-1100-46d3-8c65-fb160da0071f",
      "tier": "Medium",
      "reason": "Can set or reset authentication methods for some non-admin users"
    },
    {
      "name": "Helpdesk Administrator",
      "templateId": "729827e3-9c14-49f7-bb1b-9608f156bbb8",
      "tier": "Medium",
      "reason": "Can reset passwords for non-administrators and Helpdesk Administrators"
    },
    {
      "name": "Intune Administrator",
      "templateId": "3a2c62db-5318-420d-8d74-23affee5d9d5",
      "tier": "High",
      "reason": "Full access to Microsoft Intune including device and policy management"
    },
    {
      "name": "AI Administrator",
      "templateId": "d2562ede-74db-457e-a7b6-544e236ebb61",
      "tier": "High",
      "reason": "Can manage Microsoft 365 AI resources and current agent identity capabilities"
    },
    {
      "name": "AI Reader",
      "templateId": "1fe13547-53f6-408d-ac04-7f8eed167b38",
      "tier": "High",
      "reason": "Classified as privileged by Microsoft despite its read-oriented name"
    },
    {
      "name": "Agent ID Administrator",
      "templateId": "db506228-d27e-4b7d-95e5-295956d6615f",
      "tier": "High",
      "reason": "Can manage agent identities, authentication, and role assignments"
    },
    {
      "name": "Agent Registry Administrator",
      "templateId": "6b942400-691f-4bf0-9d12-d8a254a2baf5",
      "tier": "High",
      "reason": "Can manage the agent registry and related governance data"
    },
    {
      "name": "Authentication Extensibility Password Administrator",
      "templateId": "0b00bede-4072-4d22-b441-e7df02a1ef63",
      "tier": "High",
      "reason": "Can manage password authentication extensibility configuration"
    },
    {
      "name": "Customer Delegated Administration Relationship Administrator",
      "templateId": "fc8ad4e2-40e4-4724-8317-bcda7503ecbf",
      "tier": "High",
      "reason": "Can manage delegated administration relationships"
    },
    {
      "name": "Entra Backup Administrator",
      "templateId": "b6a27b2b-f905-4b2e-81b5-0d90e0ef1fdb",
      "tier": "High",
      "reason": "Can manage backup and recovery operations for directory objects"
    },
    {
      "name": "Identity Governance Administrator",
      "templateId": "45d8d3c5-c802-45c6-b32a-1d70b5e1e86e",
      "tier": "High",
      "reason": "Microsoft marked this role privileged in May 2026; it includes governance and service-principal assignment capabilities"
    },
    {
      "name": "Security Operator",
      "templateId": "5f2222b1-57c3-48ba-8ad5-d4759f1fde6f",
      "tier": "High",
      "reason": "Can perform identity security containment and response operations"
    },
    {
      "name": "Tenant Governance Administrator",
      "templateId": "1981f584-96e9-4a6f-95b0-f522373f8fae",
      "tier": "High",
      "reason": "Microsoft marked this cross-tenant governance role privileged in July 2026"
    }
  ]
}
